{
  "version": "2.0.0",
  "generated_at": "2026-06-02T10:25:21.672Z",
  "count": 19,
  "items": [
    {
      "id": "engineering",
      "master_agent": "engineering.master",
      "specialists": [
        "engineering.architect",
        "engineering.backend-api",
        "engineering.build-resolver",
        "engineering.code-migration",
        "engineering.code-reviewer",
        "engineering.cpp-reviewer",
        "engineering.database-design",
        "engineering.database-optimization",
        "engineering.dev-workflow",
        "engineering.docs-updater",
        "engineering.e2e-runner",
        "engineering.frontend-react",
        "engineering.frontend-vue",
        "engineering.go-reviewer",
        "engineering.java-reviewer",
        "engineering.kotlin-reviewer",
        "engineering.mobile-android",
        "engineering.mobile-ios",
        "engineering.performance-profiling",
        "engineering.planner",
        "engineering.python-reviewer",
        "engineering.refactor-cleaner",
        "engineering.refactoring",
        "engineering.rust-reviewer",
        "engineering.security-reviewer",
        "engineering.swift-reviewer",
        "engineering.tdd-guide",
        "engineering.testing-e2e",
        "engineering.testing-integration",
        "engineering.testing-unit",
        "engineering.typescript-reviewer"
      ],
      "workflows": [
        "engineering.backend-api-implementation",
        "engineering.code-migration-execution",
        "engineering.code-review-with-security",
        "engineering.database-migration",
        "engineering.docs-update",
        "engineering.fix-build-error",
        "engineering.frontend-component-creation",
        "engineering.performance-optimization",
        "engineering.refactoring-campaign",
        "engineering.repo-onboarding",
        "engineering.tdd-feature",
        "engineering.test-suite-expansion"
      ],
      "connectors": [
        "github",
        "context7",
        "pm.plane",
        "pm.openproject"
      ],
      "route_fixture_files": [
        "engineering-batch1.fixtures.json",
        "engineering-batch2.fixtures.json",
        "engineering-batch3.fixtures.json",
        "engineering-lang-reviewers.fixtures.json",
        "engineering.fixtures.json",
        "gap-close-specialists.fixtures.json",
        "phase8-scale.fixtures.json",
        "seed.fixtures.json",
        "workflow-routes.fixtures.json"
      ],
      "workflow_fixture_files": [
        "phase8.fixtures.json"
      ],
      "knowledge_pack_id": "engineering-pack",
      "hook_binding_ids": [
        "hook.pre-route.budget-safety",
        "hook.pre-tool.permission-strategy",
        "hook.pre-write.policy-contract",
        "hook.post-tool.audit-learning",
        "hook.on-error.mistake-graph",
        "hook.on-task-complete.trace-ledger",
        "hook.on-absorb.provenance-license"
      ],
      "dossier_coverage": {
        "agents": 32,
        "workflows": 12
      },
      "status": "active"
    },
    {
      "id": "engineering.language-review",
      "master_agent": "engineering.master",
      "specialists": [
        "engineering.architect",
        "engineering.backend-api",
        "engineering.build-resolver",
        "engineering.code-migration",
        "engineering.code-reviewer",
        "engineering.cpp-reviewer",
        "engineering.database-design",
        "engineering.database-optimization",
        "engineering.dev-workflow",
        "engineering.docs-updater",
        "engineering.e2e-runner",
        "engineering.frontend-react",
        "engineering.frontend-vue",
        "engineering.go-reviewer",
        "engineering.java-reviewer",
        "engineering.kotlin-reviewer",
        "engineering.mobile-android",
        "engineering.mobile-ios",
        "engineering.performance-profiling",
        "engineering.planner",
        "engineering.python-reviewer",
        "engineering.refactor-cleaner",
        "engineering.refactoring",
        "engineering.rust-reviewer",
        "engineering.security-reviewer",
        "engineering.swift-reviewer",
        "engineering.tdd-guide",
        "engineering.testing-e2e",
        "engineering.testing-integration",
        "engineering.testing-unit",
        "engineering.typescript-reviewer"
      ],
      "workflows": [
        "engineering.backend-api-implementation",
        "engineering.code-migration-execution",
        "engineering.code-review-with-security",
        "engineering.database-migration",
        "engineering.docs-update",
        "engineering.fix-build-error",
        "engineering.frontend-component-creation",
        "engineering.performance-optimization",
        "engineering.refactoring-campaign",
        "engineering.repo-onboarding",
        "engineering.tdd-feature",
        "engineering.test-suite-expansion"
      ],
      "connectors": [
        "github",
        "context7",
        "pm.plane",
        "pm.openproject"
      ],
      "route_fixture_files": [
        "engineering-batch1.fixtures.json",
        "engineering-batch2.fixtures.json",
        "engineering-batch3.fixtures.json",
        "engineering-lang-reviewers.fixtures.json",
        "engineering.fixtures.json",
        "gap-close-specialists.fixtures.json",
        "phase8-scale.fixtures.json",
        "seed.fixtures.json",
        "workflow-routes.fixtures.json"
      ],
      "workflow_fixture_files": [
        "phase8.fixtures.json"
      ],
      "knowledge_pack_id": "engineering-pack",
      "hook_binding_ids": [
        "hook.pre-route.budget-safety",
        "hook.pre-tool.permission-strategy",
        "hook.pre-write.policy-contract",
        "hook.post-tool.audit-learning",
        "hook.on-error.mistake-graph",
        "hook.on-task-complete.trace-ledger",
        "hook.on-absorb.provenance-license"
      ],
      "dossier_coverage": {
        "agents": 32,
        "workflows": 12
      },
      "status": "active"
    },
    {
      "id": "security",
      "master_agent": "security.master",
      "specialists": [
        "security.application-security",
        "security.cloud-security",
        "security.compliance-officer",
        "security.cryptography-expert",
        "security.dependency-risk-agent",
        "security.identity-access",
        "security.incident-responder",
        "security.network-security",
        "security.penetration-tester",
        "security.secret-scan-agent",
        "security.security-auditor",
        "security.security-reviewer",
        "security.threat-hunter",
        "security.threat-modeler",
        "security.vulnerability-manager"
      ],
      "workflows": [
        "security.incident-response-playbook",
        "security.penetration-test-execution",
        "security.prompt-injection-review",
        "security.repo-risk-scan",
        "security.security-audit-process",
        "security.security-compliance-check",
        "security.threat-hunting-campaign",
        "security.vulnerability-remediation"
      ],
      "connectors": [
        "github"
      ],
      "route_fixture_files": [
        "phase8-new-agents.fixtures.json",
        "security-new.fixtures.json",
        "security-specialists.fixtures.json",
        "seed.fixtures.json",
        "workflow-routes.fixtures.json"
      ],
      "workflow_fixture_files": [
        "phase8.fixtures.json"
      ],
      "knowledge_pack_id": "security-pack",
      "hook_binding_ids": [
        "hook.pre-route.budget-safety",
        "hook.pre-tool.permission-strategy",
        "hook.pre-write.policy-contract",
        "hook.post-tool.audit-learning",
        "hook.on-error.mistake-graph",
        "hook.on-task-complete.trace-ledger",
        "hook.on-absorb.provenance-license"
      ],
      "dossier_coverage": {
        "agents": 16,
        "workflows": 8
      },
      "status": "active"
    },
    {
      "id": "platform",
      "master_agent": "platform.master",
      "specialists": [
        "platform.ci-cd-engineer",
        "platform.ci-cd-pipeline",
        "platform.cloud-architect",
        "platform.cloud-cost-optimization",
        "platform.container-security",
        "platform.devops-engineer",
        "platform.gitops-workflow",
        "platform.incident-responder",
        "platform.infrastructure-testing",
        "platform.kubernetes-admin",
        "platform.monitoring-setup",
        "platform.observability-engineer",
        "platform.release-manager",
        "platform.service-mesh",
        "platform.terraform-architect"
      ],
      "workflows": [
        "platform.ci-failure-triage",
        "platform.cloud-migration",
        "platform.disaster-recovery-setup",
        "platform.incident-responder-playbook",
        "platform.kubernetes-cluster-setup",
        "platform.monitoring-stack-deployment",
        "platform.terraform-infrastructure-deployment"
      ],
      "connectors": [
        "github",
        "playwright",
        "pm.plane",
        "pm.openproject"
      ],
      "route_fixture_files": [
        "phase8-new-agents.fixtures.json",
        "phase8-specialists.fixtures.json",
        "platform-new.fixtures.json",
        "platform-specialists.fixtures.json",
        "seed.fixtures.json",
        "workflow-routes.fixtures.json"
      ],
      "workflow_fixture_files": [
        "phase8.fixtures.json"
      ],
      "knowledge_pack_id": "platform-pack",
      "hook_binding_ids": [
        "hook.pre-route.budget-safety",
        "hook.pre-tool.permission-strategy",
        "hook.pre-write.policy-contract",
        "hook.post-tool.audit-learning",
        "hook.on-error.mistake-graph",
        "hook.on-task-complete.trace-ledger",
        "hook.on-absorb.provenance-license"
      ],
      "dossier_coverage": {
        "agents": 16,
        "workflows": 7
      },
      "status": "active"
    },
    {
      "id": "meta-system",
      "master_agent": "meta-system.master",
      "specialists": [
        "meta-system.adapter-generator",